"DESCRIPTION","DURATION IN MS","NAME","PARENT SUITE","START TIME","STATUS","STOP TIME","SUB SUITE","SUITE","TEST CLASS","TEST METHOD"
"","1509","N-2: Invalid timeframe","","2025-11-14","passed","2025-11-14","","","",""
"","843","N-4: Invalid Timestamp Format - start_ts","","2025-11-14","passed","2025-11-14","","","",""
"","961","P-2: Valid optional parameters with default value.","","2025-11-14","passed","2025-11-14","","","",""
"","1421","N-3: Invalid count value","","2025-11-14","passed","2025-11-14","","","",""
"","877","N-6: Missing Required Parameter","","2025-11-14","passed","2025-11-14","","","",""
"","880","N-1: Invalid instrument name","","2025-11-14","passed","2025-11-14","","","",""
"","952","P-1: Valid required and valid optional parameters with non-default value","","2025-11-14","passed","2025-11-14","","","",""
"","2206","N-5: Invalid Timestamp Format - end_ts","","2025-11-14","passed","2025-11-14","","","",""
